{"drill":{"completedAtUtc":"2026-08-11T03:01:38.137Z","controlCount":2,"failureInjectionCount":27,"followUpActions":["withdraw_bad_artifact","preserve_redacted_evidence","verify_source_checksum_signer","ship_greater_version_code_forward_fix","escalate_unrecoverable_or_security_incident"],"outcomes":[{"result":"WITHDRAW_AND_FORWARD_FIX","scenario":"bad_release"},{"result":"REJECT_UNVERIFIED_CANDIDATE","scenario":"checksum_failure"},{"result":"VERIFIED_UPDATE_COMMITTED","scenario":"committed_update"},{"result":"TOKEN_REVOKE_ROTATE","scenario":"compromised_token"},{"result":"REFUSED_MUTATION_PRESERVED_RAW","scenario":"corrupt_data"},{"result":"REJECT_DOWNGRADE","scenario":"equal_version"},{"result":"REFUSED_MUTATION_PRESERVED_V1","scenario":"failed_upgrade"},{"result":"OLDER_READER_REFUSED_PRESERVED_RAW","scenario":"future_data"},{"result":"CLOSED_NO_DOWNGRADE","scenario":"incident_matrix"},{"result":"REPAIR_REQUIRED_CIPHERTEXT_PRESERVED","scenario":"key_loss"},{"result":"REJECT_DOWNGRADE","scenario":"older_version"},{"result":"DISCARD_PARTIAL_DOWNLOAD","scenario":"partial_download"},{"result":"ABANDON_PARTIAL_INSTALL_SESSION","scenario":"partial_install"},{"result":"REJECT_UNVERIFIED_CANDIDATE","scenario":"signer_failure"},{"result":"REJECT_UNVERIFIED_CANDIDATE","scenario":"source_failure"},{"result":"SSH_IDENTITY_REVERIFY","scenario":"ssh_host_key"},{"result":"RESTORED_OLD","scenario":"transaction_after_backups"},{"result":"KEPT_NEW","scenario":"transaction_after_committed_journal"},{"result":"RESTORED_OLD","scenario":"transaction_after_first_backup_delete"},{"result":"RESTORED_OLD","scenario":"transaction_after_first_install"},{"result":"RESTORED_OLD","scenario":"transaction_after_first_journal"},{"result":"RESTORED_OLD","scenario":"transaction_after_first_stage_delete"},{"result":"KEPT_NEW","scenario":"transaction_after_journal_removal"},{"result":"RESTORED_OLD","scenario":"transaction_after_prepared_journal"},{"result":"RESTORED_OLD","scenario":"transaction_after_second_backup_delete"},{"result":"RESTORED_OLD","scenario":"transaction_after_second_install"},{"result":"KEPT_NEW","scenario":"transaction_after_second_journal"},{"result":"RESTORED_OLD","scenario":"transaction_after_second_stage_delete"},{"result":"RESTORED_OLD","scenario":"transaction_after_staging"}],"recoveryMillis":1226,"scenarioCount":29,"startedAtUtc":"2026-08-11T03:01:36.911Z"},"lanes":[{"evidence":"CPU_UNIT","id":"cpu.corrupt_future_refusal","status":"PASS"},{"evidence":"CPU_UNIT","id":"cpu.interrupted_transaction_recovery","status":"PASS"},{"evidence":"CPU_UNIT","id":"cpu.failed_upgrade_refusal","status":"PASS"},{"evidence":"CPU_UNIT","id":"cpu.key_loss_refusal","status":"PASS"},{"evidence":"CPU_UNIT","id":"cpu.partial_update_simulation","status":"PASS"},{"evidence":"CPU_UNIT","id":"cpu.rollback_decision_policy","status":"PASS"},{"evidence":"CPU_UNIT","id":"cpu.incident_runbook","status":"PASS"},{"evidence":"EXTERNAL","id":"ci.disposable_signing_continuity","status":"NOT_RUN"},{"evidence":"EXTERNAL","id":"external.real_signing_key_custody","status":"NOT_RUN"},{"evidence":"EXTERNAL","id":"physical.protected_app_update_recovery","status":"NOT_RUN"},{"evidence":"EXTERNAL","id":"live.release_withdrawal","status":"NOT_RUN"},{"evidence":"EXTERNAL","id":"human.incident_escalation","status":"NOT_RUN"}],"limitations":["CPU file and state models do not prove Android package-installer behavior.","CI signing continuity and offline custody of real signing keys remain external.","No live release was withdrawn and no protected package was installed or downgraded.","Human incident escalation and recovery comprehension remain external."],"milestone":"M20","receiptDigest":"fdc322bf8f926ac4b2339f714d23a330a16815a715adfcee981f8146ae88088b","safety":{"destructiveLiveMigrationRun":false,"olderApkInstalled":false,"physicalDeviceTouched":false,"productionSigningMaterialAccessed":false,"protectedPackageTouched":false},"schema":"codecks.autonomous-maturity.m20-rollback-rehearsal.v1","scope":"CPU_FAKE_SOURCE_BOUND","sourceCommit":"a899c24ac10d2f393ac5ba41d7a47830f6a96f09","sources":[{"path":"app/src/main/java/io/codecks/data/persistence/BoundedPersistence.kt","sha256":"a7341de09499f824e4cf0e981abbaf6fae3e3f4be7a203135fdc95eb20621aa9"},{"path":"app/src/main/java/io/codecks/domain/update/ReleaseRecoveryPolicy.kt","sha256":"3f3dfd6a0be29be07bd36e450f556ebf1efb127c5103524c37ac5220323c25fa"},{"path":"app/src/test/java/io/codecks/data/persistence/M20RollbackIncidentRehearsalTest.kt","sha256":"3bc43d654a409f9d615fba00cc4f1c5afa290dc80299158547a052f9b929e32c"},{"path":"docs/release/ROLLBACK_AND_INCIDENT_RUNBOOK.md","sha256":"45003b4b593b5e70d80c74069fca3cee33b358a88d2cdc89b73dbba5ee73ea89"},{"path":"scripts/run_m20_rollback_rehearsal.sh","sha256":"7d1d3996ce2e05b1eec6f8f7e5b530ee41219c4d843cd44ce1ef2d90b10a1f60"},{"path":"tools/evidence/collect_m20_rollback_rehearsal.py","sha256":"aeee48e892c9e1d49c36f40f843141f27c50cfc262adebf706694c24d3e6030a"},{"path":"tools/evidence/test_m20_rollback_rehearsal.py","sha256":"b0572d3f20a7d6949506f0a1762cecda354e695b5a1845304be4e58325f4daaa"},{"path":"tools/evidence/validate_m20_rollback_rehearsal.py","sha256":"aee6d75733c97d13c9f37a2325df77d5ee8db7f7bbf3b574c4b67871c009e976"},{"path":"tools/evidence/schemas/autonomous-maturity-m20-rollback-rehearsal-v1.schema.json","sha256":"a6206cffae29b8471c4053e3f2c680194664643ba540163e5b81be3e22ab7150"}],"status":"PASS","summary":{"fail":0,"notRun":5,"pass":7},"unitResult":{"className":"io.codecks.data.persistence.M20RollbackIncidentRehearsalTest","errors":0,"failures":0,"methods":["badReleaseRollbackMeansWithdrawalAndForwardFix","corruptAndFutureDataFailClosed","failedUpgradePreservesOlderData","incidentPolicyHasClosedActionableDecisionForEveryIncident","interruptedTransactionsRecoverExactGeneration","keyLossNeverFallsBackToCiphertext","partialUpdateSimulationRejectsEveryIncompleteOrUnverifiedState"],"path":"tasks/test-evidence/m20/runtime/TEST-M20RollbackIncidentRehearsalTest.xml","sha256":"f3aacbd54db1a446e6dead7d49d84070e27477bf656f40578d21370a28ea09aa","skipped":0,"tests":7},"validatorCases":{"negative":19,"positive":1}}
